{
  "schemaVersion": "1.0.0",
  "probeVersion": "phase0-retrieval-gate-v1",
  "generatedAtUtc": "2026-07-18T10:26:54.017898+00:00",
  "status": "PASS",
  "infrastructure": {
    "imageDigest": "sha256:11e8b3921b9f1a58965afaad4a844c435c9807cbc82c51e47cb147b7d977fc88",
    "imageId": "sha256:64873a491e839963036d1171122695e3eb5780addb931a6b1df01dbf7bee921d",
    "infinityVersion": "0.0.77"
  },
  "models": [
    {
      "modelId": "BAAI/bge-small-zh-v1.5",
      "revision": "7999e1d3359715c523056ef9478215996d62a620",
      "servedName": "embedding-bge-small-zh-v1.5",
      "license": "MIT"
    },
    {
      "modelId": "BAAI/bge-reranker-v2-m3",
      "revision": "953dc6f6f85a1b2dbfca4c34a2796e7dde08d41e",
      "servedName": "reranker-bge-v2-m3",
      "license": "Apache-2.0"
    }
  ],
  "machine": {
    "os": "Windows-10-10.0.26200-SP0",
    "cpu": "AMD Ryzen 7 5800H with Radeon Graphics",
    "logicalCpu": 16,
    "hostMemoryBytes": 17024741376,
    "dockerCpu": 16,
    "dockerMemoryBytes": 8247738368,
    "gpu": "NVIDIA GeForce RTX 3060 Laptop GPU, 6144 MiB, 591.74",
    "gpuAssignedToContainer": false,
    "inferenceDevice": "cpu"
  },
  "resource": {
    "startup": {
      "coldPreloadMs": 639700.0,
      "coldPreloadIncludesDownloadAndDefaultWarmup": true,
      "warmCacheStartupMs": 109325.0,
      "warmCacheStartupConfiguration": "batch=4,no-model-warmup"
    },
    "maximumLengths": {
      "embedding": {
        "modelMaxPositionEmbeddings": 512,
        "tokenizerMaxLength": 512
      },
      "rerank": {
        "modelMaxPositionEmbeddings": 8194,
        "tokenizerMaxLength": 8192
      }
    },
    "concurrency": {
      "wallMs": 2464.797,
      "results": [
        {
          "kind": "embedding",
          "expectedModel": "embedding-bge-small-zh-v1.5",
          "actualModel": "embedding-bge-small-zh-v1.5",
          "elapsedMs": 134.816,
          "items": 3,
          "itemsPerSecond": 22.252,
          "identityAndShapeValid": true
        },
        {
          "kind": "rerank",
          "expectedModel": "reranker-bge-v2-m3",
          "actualModel": "reranker-bge-v2-m3",
          "elapsedMs": 1234.876,
          "items": 4,
          "itemsPerSecond": 3.239,
          "identityAndShapeValid": true
        },
        {
          "kind": "embedding",
          "expectedModel": "embedding-bge-small-zh-v1.5",
          "actualModel": "embedding-bge-small-zh-v1.5",
          "elapsedMs": 253.827,
          "items": 3,
          "itemsPerSecond": 11.819,
          "identityAndShapeValid": true
        },
        {
          "kind": "rerank",
          "expectedModel": "reranker-bge-v2-m3",
          "actualModel": "reranker-bge-v2-m3",
          "elapsedMs": 2415.563,
          "items": 4,
          "itemsPerSecond": 1.656,
          "identityAndShapeValid": true
        }
      ],
      "medianInterferenceRatioVsSerial": {
        "embedding": 1.134,
        "rerank": 1.171
      }
    },
    "containerStatsAfter": {
      "BlockIO": "33.1MB / 68.1MB",
      "CPUPerc": "0.79%",
      "Container": "opspilot-infinity-phase0",
      "ID": "14b8d21dc66d",
      "MemPerc": "17.76%",
      "MemUsage": "1.364GiB / 7.681GiB",
      "Name": "opspilot-infinity-phase0",
      "NetIO": "347kB / 283kB",
      "PIDs": "102"
    }
  },
  "embedding": {
    "dimension": 512,
    "normalizationConvention": "L2_UNIT",
    "cosineNonZeroNorm": true,
    "inputSetSha256": "54fe5dc0830548ca65432e919e05957ad652ed1fa675f426f4faf3f1c0cd128c"
  },
  "rerank": {
    "responseModel": "reranker-bge-v2-m3",
    "returnedIndices": [
      2,
      0,
      1,
      3
    ],
    "caseSha256": "9b84327e7bff21d6821c1bd9e4fbfd783f9f067a5736f868d4cb2644f5491c1a"
  },
  "quality": {
    "datasetSha256": "6facc7a8b5fcbe73697e1b9c640da943d019493e16e1881b875b5a2eae515573",
    "queryCount": 5,
    "aggregate": {
      "baselineNdcgAt10": 0.6897744744000489,
      "rerankNdcgAt10": 0.7455904775773011,
      "baselineMrr": 0.7,
      "rerankMrr": 0.7,
      "ndcgRelativeImprovement": 0.08091920656501501,
      "mrrRelativeImprovement": 0.0
    }
  },
  "latency": {
    "inputSha256": "9b84327e7bff21d6821c1bd9e4fbfd783f9f067a5736f868d4cb2644f5491c1a",
    "sampleCount": 20,
    "aggregation": "nearest-rank: sorted[ceil(p*N)-1]",
    "latencyMs": {
      "p50": 1213.135,
      "p95": 1338.59,
      "thresholdP95Exclusive": 2000.0
    }
  },
  "sourceReports": {
    "identity": "62c03605d981d9d607367e2276cd870eca0eb371dcca105bd27f5d0323334330",
    "embedding": "f46d60a057c7190cb7b7353ac847d890100d5077c43a025bf48abbeabb26ecc1",
    "rerank": "0cc9867210db9c0f6114eaf6485f540761e6d6d9983ef41c3e1c2594f8d2981d",
    "concurrency": "8766d9e6e4e2cd4b06011aa70a88eefc6081ebf848e1eae3626622bbb4918e19",
    "quality": "05638efe52fcbae35dbdc3c944532841569ec0606e7a4607b9b0eb6c2c3eb1fa",
    "latency": "63a093ae93254007d600aeb5b460b2788e1f05abee0bc645556aa2b1462de20c"
  },
  "failures": []
}
